body,title,url"
Hace unos días el presidente Andrés Manuel López Obrador dejó ver, en una reunión con sus colaboradores, el enojo y desprecio que siente por el gobernador de Chihuahua, Javier Corral. Cuando alguien mencionó el nombre del mandatario panista, la reacción fue automática: “Ese es un vulgar traidor y mentiroso”, dijo el Presidente. La razón de la molestia presidencial tiene que ver con el conflicto por el agua de las presas federales ubicadas en territorio chihuahuense, que ha escalado en las últimas horas y con la percepción que tienen en Palacio Nacional de que Corral “está azuzando a los campesinos” del Distrito de Riego 05 en Camargo y Delicias, que el martes pasado burlaron y expulsa ron a la Guardia Nacional y tomaron el control de la Presa “La Boquilla”, expulsando también al personal de la Comisión Nacional del Agua.
La animadversión entre López Obrador y Corral no es nueva y data de hace varios años. El presidente acusa que Corral coqueteaba con la izquierda pero siempre terminó traicionándola por sus filias panistas. En la campaña del 2018 se enfrentaron en varias ocasiones y ya como presidente, aunque han mantenido una relación cortés, en el gobierno federal se quejan de que el mandatario chihuahuense no ha correspondido al apoyo que se le ha dado en temas como la captura y solicitud de extradición del exgobernador César Duarte, su antecesor acusado de corrupción.
Hoy esa mala relación política se mezcla con un conflicto que está tomando proporciones preocupantes ante la actitud desafiante de los campesinos que acusan al gobierno de López Obrador y a la Conagua de estarles quitando el agua de las presas “El Granero” y “Las Vírgenes” y de querer vaciar también el agua de “La Boquilla” para cumplir con un pago de un adeudo del Tratado de Aguas entre México y Estados Unidos que data de 1944. A los ánimos caldeados de los aguerridos agricultores chihuahuenses, el gobierno federal ha respondido con el envío de la Guardia Nacional que mantenía vigilada y cercada desde hace varias semanas las instalaciones de “La Boquilla”, en donde ya había habido un par de enfrentamientos con gases lacrimógenos antes de la toma de la instalación federal el pasado martes.
La acción en la que cientos de campesinos rebasaron a la Guardia Nacional y se apoderaron de los cuartos de control de la Presa para cerrar las compuertas y evitar el trasvase de agua, terminó con la expulsión y humillación de los elementos del cuerpo de seguridad federal que, para evitar una confrontación, abandonaron el lugar en medio de gritos, burlas y acusaciones de los agricultores que celebraban como un triunfo haber obligado al retiro de los elementos federales. Pero en su retirada, según la versión de testigos y que ayer denunció en un video el gobernador Javier Corral, varios integrantes de la Guardia Nacional abrieron fuego contra un matrimonio de productores que también se retiraba de “La Boquilla”, causando la muerte a balazos de una mujer y dejando gravemente herido al hombre. Según Corral, la pareja fue atacada por la espalda, mientras que el reporte oficial de la Guardia habló de “un enfrentamiento a balazos” con presuntos atacantes.
Ayer el choque entre la Federación y Chihuahua también escaló por estos hechos. De un lado López Obrador acusó en la conferencia mañanera que “hay intereses políticos y electorales” en el conflicto de los agricultores y negó que su gobierno esté quitándoles el agua para sus cultivos  y por el contrario acusó que hay corrupción en el manejo del agua en el Distrito de Riego 05, donde habló de un “huachicoleo del agua” que se está investigando. Incluso, el Presidente le pidió a la Fiscalía General de la República que inicie una investigación para determinar las responsabilidades que se cometieron al tomar por asalto instalaciones federales en la citada presa lo que constituye, dijo, un delito federal. También por la tarde, el subsecretario de Seguridad federal, Ricardo Mejía, advirtió que “las presas son instalaciones estratégicas del Estado y no se permitirá la violencia ni su politización”.
Por la tarde, Javier Corral contraatacó con el anuncio de una investigación a la Guardia Nacional desde la Fiscalía de Justicia de Chihuahua por el caso de la mujer chihuahuense y su esposo que fueron atacados a balazos por miembros del cuerpo federal. El gobernador solicitó a la Fiscalía General de la República que colabore y atraiga la investigación de lo sucedido en la agresión a balazos que, de acuerdo con testigos, le costó la vida a la mujer y dejó gravemente herido a su esposo. “Vamos a poner todo el empeño de las instituciones para que se haga justicia”, dijo el panista, mientras el fiscal General de Chihuahua, César Peniche, mandaba oficios para pedir al gobierno federal que le permita el acceso y el aseguramiento de las armas con la que los guardias nacionales dispararon contra la pareja de productores chihuahuenses.
Veremos en qué termina este conflicto en el que, por lo pronto, los agricultores chihuahuenses mantienen el control de una presa federal y amenazan con no permitir el regreso de las autoridades federales, mientras acusan al gobierno de López Obrador de “robarles el agua a los chihuahuenses” y de atentar en contra del sustento de sus familias al pretender quitarles el agua para sus cultivos. El gobierno federal, donde por cierto la directora de la Conagua, Blanca Jiménez Cisneros, ha brillado por su incapacidad para operar y resolver el conflicto, insiste en que el agua es propiedad nacional y que en ningún momento está poniendo en riesgo los volúmenes de riego para los campesinos de Delicias y Camargo.
Y detrás del conflicto hídrico de Chihuahua, en el que literalmente las aguas amenazan con desbordarse en un estado de profundas raíces revolucionarias y cuyos productores advierten que no se van a dejar robar el agua que le quieren mandar a Estados Unidos, aparece el conflicto político en el que a la añeja animadversión entre Andrés Manuel López Obrador y Javier Corral, que nunca se han querido, se suman también las aspiraciones futuristas de Corral a las que en Palacio Nacional se refieren como “sueños guajiros” del panista por la candidatura presidencial en el 2024.

NOTAS INDISCRETAS…

El secretario de Hacienda, Arturo Herrera, se veía ayer miércoles contento con la forma en que, en términos generales, fue recibido el proyecto de Presupuesto 2021. En medio de la que él mismo llamó “la peor crisis que hayamos enfrentado después de la Gran Depresión”, a la propuesta de Herrera no le fue tan mal, en términos de las críticas y el balance de los analistas, que si bien cuestionaron la falta de medidas contracíclicas para promover la recuperación económica y el desbordado optimismo en las cifras de caída y crecimiento del PIB para 2020 y 2021, en términos generales consideraron al presupuesto como equilibrado y racional. Las calificadoras internacionales solo cuestionaron la falta de apoyos fiscales para la recuperación, aunque también en general avalaron el documento de Hacienda como una señal responsable para el manejo de las finanzas federales. Ante las críticas del optimismo excesivo, Herrera comentaba ayer en su despacho que “los analistas me acusan de optimista y el Presidente de pesimista, entonces no estamos tan mal”. Y en cuanto a la falta de medidas para promover la recuperación, aseguró que el aumento al gasto de infraestructura y la apuesta a proyectos prioritarios de la 4T y del presidente López Obrador, tienen como objetivo, precisamente, apostar a la generación de empleos y crecimiento. En fin, que Herrera está tranquilo y no espera grandes sorpresas en el análisis y dictaminación de la Cámara de Diputados, donde la mayoría de Morena le garantiza la aprobación sin contratiempos ni sobresaltos… A propósito del Presupuesto, sobre el dato de que el 16% de los recursos federales para el 2021 se destinarán al pago de pensiones del gobierno federal, ayer el presidente López Obrador firmó una iniciativa de Reforma al Sistema de Pensiones gubernamentales, con lo que su gobierno pretende disminuir la excesiva carga fiscal de las pensiones y hacer frente a un problema que han “pateado” los anteriores gobiernos. La iniciativa será enviada al Congreso y tendrá que ser negociada y operada con los poderosos sindicatos del gobierno. Veremos las reacciones y lo que propone el gobierno lopezobradorista para resolver uno de los más graves problemas financieros para el país: el oneroso sistema pensionario…Dados girando. Escalera doble.
[email protected]
",,http://www.eluniversal.com.mx/opinion/salvador-garcia-soto/el-doble-conflicto-de-chihuahua
"
Las sospechas de corrupción y tráfico de influencias en la Secretaría de Comunicaciones y Transportes (SCT) del gobierno de la Cuarta Transformación se superan unas a otras, principalmente en la Subsecretaría de Infraestructura a cargo de Cedric Escalante Sauri, como se ha reportado en este espacio.
La semana pasada informamos que el subsecretario tiene tratos e influencia en todos los centros estatales de la SCT donde se despachan contratos de obra pública a un selecto grupo de empresas.
Otro personaje del que no se había hablado, pero que acompaña a Escalante Sauri desde hace muchos años en sus negocios es Francisco Raúl Chavoya Cárdenas, actual director general de Carreteras en la SCT.
Desde ese puesto, Chavoya Cárdenas cuenta con todo el respaldo de su jefe y amigo a la hora de recomendar a empresas ‘amigas’ para convertirlas en las elegidas para desarrollar diversas obras, de acuerdo con una decena de contratistas y funcionarios en activo de la dependencia.
El director de Carreteras pasó 11 años como gerente general en Consultores y Constructores Escalante S.A. de C.V., del ahora subsecretario Escalante, firma que ganó por lo menos 436 millones de pesos vía contratos con la SCT durante los sexenios de Felipe Calderón y Enrique Peña Nieto.
Chavoya Cárdenas se desempeñó como jefe de la Unidad General de Servicios Técnicos en el Centro SCT Guerrero de 1983 a 1992, y como coordinador en la Dirección General de Carreteras de 2002 a 2007.
En junio de 2007 dejó el sector público para asumir la gerencia general en la compañía de Escalante Sauri, mediante la cual obtuvieron cerca de 30 contratos públicos. Renunció en noviembre de 2018 para integrarse al gobierno de la Cuarta Transformación.
Al igual que Cédric Escalante y el flamante titular de la SCT, Jorge Arganis, son viejos conocidos del sector de infraestructura, tanto en la parte privada como en la función pública.
Cedric Escalante ingresó a la administración pública en 1983 en el sexenio de Miguel de la Madrid, cuando asumió la dirección del Centro SCT Tabasco, el mismo año en el que Andrés Manuel López Obrador fue nombrado presidente del Comité Directivo Estatal del Partido Revolucionario Institucional en dicha entidad.
Durante sus 24 años al interior de la dependencia, el actual subsecretario de Infraestructura conoció las operaciones de las áreas técnicas, de supervisión y de adquisiciones, con lo que pudo comenzar con el “pie derecho” su carrera como empresario, pues a pesar de que la Ley Federal de Responsabilidades Administrativas establecía que debía pasar un año antes de trabajar en una empresa relacionada con su cargo anterior, constituyó la compañía 49 días antes de abandonar las filas de la SCT, en febrero de 2007.
En octubre de ese mismo año, Consultores y Constructores Escalante S.A. de C.V había obtenido el primero de sus convenios con la Dirección General de Conservación de Carreteras de la SCT por 704 mil pesos.
El actual subsecretario de Infraestructura ha sido denunciado por el diputado potosino Ricardo del Sol, quien lo acusa de poseer una red de testaferros y prestanombres que realizan simulaciones en la asignación de contratos.
Unos de estos tienen que ver con su amigo Marcos Salas, un expanista expulsado de las filas de la CMIC y quien está al frente de la confederación veracruzana.
Las obras en Veracruz que la subsecretaría a cargo de Cédric Escalante ha concedido al Grupo Constructor Empresarial Taurus, cuyo apoderado legal es Marcos Salas, sumaron más de 20 millones de pesos en 2018. El 21 de mayo pasado se vio beneficiado por la adjudicación de un proyecto para reconstrucción y obras en el camino Almolonga–Tepetates–Tepetlán, con un valor de 12 millones 620 mil pesos.
 @MarioMal[email protected]
",,http://www.eluniversal.com.mx/opinion/mario-maldonado/subsecretario-lleva-directivo-de-su-empresa-sct
"
Estimados Fanáticos Morenenses: Les juro que no les puedo creer. No puedo creer el fanatismo que le tienen al Gran Jefe. La reverencia que le hacen al presidente cada vez que les habla. Le creen ¡TODO! No importa si les miente, les toma el pelo o les dice la verdad. Ustedes…. le creen TODO.
Les juro que nunca en mi vida había experimentado esa sensación de ingenuidad. Pero en fin, allá ustedes y sus creencias.
El motivo de mi Carta Semanal es para demostrarles un poco la estrategia de nuestro gran líder, su gabinete y la nefasta 4T que planearon desde el primer día que ganó la elección:
Hablemos primero de su estrategia: Muy fácil.
1.- Él y su gabinete nunca tendrán la culpa de nada. ¡NUNCA!
2.- La culpa SIEMPRE la tendrán los OTROS. ¿Cuáles otros? Los que quieran. Desde Peña Nieto hasta Brozo. Desde la pandemia hasta lo que se les ocurra pasando por Calderón, Peña Nieto etc.
3.- Cuando las cosas vayan mal, inventen historias para desviar la atención. Ya saben, la venta de boletos de la rifa del avión sin avión va increíble, los niños con cáncer sí tienen medicinas, los muertos por la pandemia son culpa de los refrescos y los productos chatarras no del inepto de López-Gatell, ya salimos de la pandemia aunque según estudios llevemos más de 130 mil muertos, nuestra economía va súper, no se han perdido empleos, somos mejor que Curazao y Belize etc., etc. 
¡¡NUNCA TOQUEN EL TEMA!! Y si lo tocan es para decirle al “pueblo bueno” que todo está ¡¡IN-CRE-Í-BLE!!
4.- INVENTEN ENEMIGOS. Eso siempre funciona de pelos.
5.- INVÉNTENLE TÍTULOS A SUS ENEMIGOS. Ya saben, adversarios, neoliberales, empresarios, medios de comunicación enemigos, etc., etc. Eso también funciona muy bien.
6.- También, INVENTEN CÓMPLICES como: El “Pueblo Bueno” “El Pueblo Sabio”, etc.etc. Esos ápodos son ¡PER-FEC-TOS!
7.- Y por último: ¡REPITAN Y REPITAN LO MISMO MIL VECES! Échenle la culpa a quienes quieran y desmárquense de la jugada. Acuérdense que PERCEPCIÓN SIEMPRE SUPERA A LA REALIDAD.
Queridos fanáticos Morenenses. Esta es la NETA DE LAS NETAS. Ahora les voy a dar un pequeño resumen de la realidad en nuestro país. Y con todo respeto, me vale madres si me creen o no.
Corrupción.- El gobierno de AMLO ya SUPERÓ al de Peña Nieto. Según la Organización Mundial de Comercio (WTO), México pasó del 14avo lugar mundial al SÉPTIMO. Su gabinete es igual o más corrupto que el de Peña. Desde los familiares y amigos del presidente, hasta los compadres de los miembros del gabinete o los colaboradores de su mismo gabinete.
Salud.- Estamos en un estado LAMENTABLE. Desde el INEPTO y GRILLO de López-Gatell hasta el Insabi, que es una basura y que no sirve para nada. Y sí, es verdad. Los niños con cáncer NO TIENEN MEDICINAS.
Empleo.- Por culpa de López Obrador, tenemos más de 10 millones de desempleados. Y desgraciadamente…. Vamos a seguir por ese camino de quiebras de pequeñas empresas y mayor desempleo. 
Seguridad.- 70 mil muertos este semestre. Otro récord de la 4T.
Y nada más para que sepan: Corea del Sur, Japón, Australia, Estados Unidos y Canadá van a recuperar su economía entre 8 meses y 1 año y medio. México…. 6 años a partir de 2021. Y esos 6 años, son para igualar la economía que Peña Nieto nos dejó en 2018. De ese tamaño es la INEPTITUD de la 4T.
Y para terminar: Ojalá y muchos de ustedes se den cuenta de las mentiras del presidente y de su gabinete y les caiga el veinte del daño IRREPARABLE que ya nos hizo este gobierno, y que el 6 de Junio de 2021, POR EL BIEN DE MEXICO, ojalá y voten en contra de Morena. Yo sé lo que les digo. 
",,http://www.eluniversal.com.mx/opinion/carlos-alazraki/carta-dirigida-los-fanaticos-de-morena-pan-no-circo-si
,,https://www.eluniversal.com.mx/edicion-impresa
,,http://www.eluniversal.com.mx/autor-opinion/columnistas/hector-de-mauleon/en-tercera-persona
