body,title,url"
En el torneo de los bandazos, de la irregularidad y de la escasa ambición de los equipos, hay decepciones puntuales, tanto en el campo, como fuera. Entrenadores “perfectos” que no encuentran en ellos a los responsables de malos funcionamientos. Miguel Herrera, José Manuel de la Torre y Antonio Mohamed son los ejemplos más significativos.
El entrenador del América no explica nunca por qué alineó a ocho futbolistas de condiciones defensivas en contra de San Luis, Mazatlán y Puebla, porque desperdició tres primeros tiempos, pero sí destaca que en la cancha del Puebla jugó bien, como si nadie hubiera visto el primer lapso, que fue francamente pobre. Según el Piojo, no ve redes sociales, y por eso no le afecta el #FueraPiojo; entonces, por qué será que sabe de quienes lo han criticado precisamente por eso, por tener tanto miedo a perder contra rivales de escasa calidad. 
Mohamed es un caso sistemático de lo que pasa. Un equipo que no se entiende en el campo, que sus futbolistas no están en el nivel que corresponde a su precio y sin ideas desde el banquillo. Cobardemente, al terminar el duelo contra Atlas, donde en casa terminaron empatados jugando un pésimo partido, el entrenador culpa a los futbolistas; claro, de manera genérica, porque no tuvo ni el valor de particularizar. Por cierto, el técnico es quien pone a dos puntas como Funes Mori y Janssen, quien diseña los partidos y la estrategia, y quien debe sacar lo mejor de cada uno de sus futbolistas. Pretextos que hunden a un entrenador que ya caducó en Monterrey, porque parece solamente defender su contrato, no su futbol.
 

 

José Manuel de la Torre igualmente lo hizo. Hace unos días culpó a los futbolistas; claro que él no está equivocado, porque para liquidarlo deben pagarle todo el contrato y esa fue una audaz jugada del Chepo. Así que, si se equivoca, la única que pagaría sería la directiva del Toluca; obviamente, también la afición del equipo escarlata, que hoy es una caricatura en el campeonato.
Víctor Vucetich, contrario a esto, señala con nombre y apellido. Para el siguiente partido, Macías no cobrará los penaltis y en la portería veremos seguramente a Raúl Gudiño, en lugar de Toño Rodríguez. A Vucetich, si falla lo echan; a un futbolista, si falla lo sientan. Esa es la gran diferencia.
El mundo de lo pretextos desde las conferencias de prensa virtuales es la nueva moda en el futbol mexicano. Tal vez por esa poca facilidad que tienen los reporteros en preguntar a la distancia, por no poder replicar una respuesta. Hoy, más que nunca, la comodidad de las conferencias de prensa es evidente, con preguntas controladas, con “amigos” de la institución del otro lado del zoom. Pero todo eso no evita que los aficionados vean los partidos y se den cuenta que muchos, pero muchos de ellos, solamente están poniendo pretextos, cuidando su chamba y su imagen; su dinero, pues.
",,http://www.eluniversal.com.mx/opinion/gerardo-velazquez-de-leon/el-zoom-el-mejor-defensor-de-los-entrenadores
"

Leo en la primera plana del Washington Post que poco antes de ser asesinado, el periodista Jamal Khashoggi, un duro crítico del casi poder absoluto de la corona en su natal Arabia Saudita, detectó un cambio drástico en los comentarios que recibía por su trabajo:

“Las habituales críticas a sus artículos en las redes sociales árabes se volvieron mensajes ásperos, personales, incluso amenazantes. Saudís influyentes lo injuriaban en Twitter llamándolo ‘extremista’, ‘criminal’ y ‘burro’, ataques que eran instantáneamente repetidos y amplificados por montones de otras cuentas de Twitter, algunas de ellas vinculadas a funcionarios saudís.

“Diez meses después, Khashoggi estaba muerto, su cuerpo destazado por agentes saudís que le tendieron una trampa para atraerlo al consulado saudí en Estambul, presuntamente por ordenes del príncipe Mohammed bin Salman, el poderoso heredero de la corona”, relata el reportaje de Joby Warrick.

¿Entonces no pesan las palabras? ¿Entonces a las palabras no se las lleva el viento?

No puedo dejar de pensar que en México desde el púlpito del hombre más poderoso del país, el presidente Andrés Manuel López Obrador, el tono de los ataques que recibe cualquier periodista crítico empatan con los que recibía Khashoggi antes de su muerte. Se sueltan injurias y adjetivos sin pensar en consecuencias. Los dice el presidente. Los replican sus funcionarios del gabinete, sus legisladores, sus partidarios. Los reproducen sus voceros formales e informales. Criminal, le decían por Twitter a Khashoggi. Sicario, dicen aquí. Y el mismo modus operandi: en el acto, hordas de cuentas de Twitter repiten y amplifican el mensaje.

No voy a dejar de levantar las alertas ni voy a dejar de decirlo: en un país con los niveles de violencia e impunidad que tiene México, la violencia verbal se convierte fácilmente en violencia física. Por ello, el presidente López Obrador es una amenaza a la libertad de expresión. Lo han denunciado todas las organizaciones que buscan defender este derecho. El presidente de México es una vergüenza internacional cuando se trata de respeto a la crítica, una referencia mundial de lo que no debe hacerse.

El presidente de México tiene un concepto peculiar del poder. Cree que es legítimo usarlo para destruir a quienes no piensan como él y echa mano abiertamente de los recursos e instrumentos del gobierno y del Estado para ello. Al mismo tiempo se dice demócrata y tolerante. No es lo uno ni lo otro. Y no es nuevo, es fácil documentar sus dichos y sus actos en contra de ciudadanos y periodistas que lo critican o publican información que no se ajusta a su muy particular visión de la realidad, durante toda su carrera política.

Sus propagandistas oficiales y oficiosos se hacen eco de las injurias, amenazas e intimidaciones. La estructura de comunicación que ha construido no es la de un gobierno demócrata sino un aparato oficial de propaganda, una maquinaria diseñada para restringir la libertad de expresión que se parece más a los de regímenes iliberales como los que se han consolidado en años recientes en el mundo o a los de sistemas francamente autocráticos. Sí, como el de Arabia Saudita.

[email protected]
",,http://www.eluniversal.com.mx/opinion/carlos-loret-de-mola/primero-lo-insultaron-en-twitter-luego-lo-descuartizaron
,,http://www.eluniversal.com.mx/gerardo-velazquez-de-leon/el-fondo-del-meollo
,,http://www.eluniversal.com.mx/autor-opinion/columnistas/carlos-alazraki/las-cartas-de-alazraki
"
La Comisión Europea (UE) advirtió este jueves que no dudará en recurrir a acciones legales contra el controvertido proyecto de ley británico que revisa parcialmente los compromisos adoptados en el marco del Brexit.
En un comunicado, el vicepresidente de la Comisión, Maros Sefcovic, recordó que el Acuerdo de Retirada ""contiene mecanismos y remedios legales para tratar violaciones a las obligaciones (...), que la Unión Europea no dudará en utilizar"".
El funcionario apuntó que ese proyecto de ley ""ha dañado seriamente la confianza"" entre las partes y que ""ahora cabe al gobierno británico restablecer esa confianza"".
Por ello formuló un llamado a Londres para que ""retire esas medidas del proyecto de ley lo antes posible, y en cualquier caso antes del fin de mes"".
""La UE no acepta el argumento de que la intención del proyecto de ley es proteger el Acuerdo de Viernes Santo. De hecho, considera que hace lo opuesto"", reza la nota de la Comisión Europea. 
En la opinión de Sefcovic, en caso de que la ley sea aprobada tal como está propuesta ""constituiría una violación extremadamente grave del Acuerdo de Retirada y de la ley internacional"". 
Sefcovic se reunió este jueves en Londres con el influyente ministro del Gabinete, Michael Gove, para discutir de urgencia esta cuestión. 
En la víspera, la AFP tuvo acceso a un borrador preparado por diplomáticos europeos en Bruselas donde se consideraba la posibilidad de una acción legal contra Londres por el controvertido proyecto de ley. 
""Una vez que se adopte el proyecto de ley (como está propuesto), la Comisión puede iniciar un procedimiento de infracción contra el Reino Unido por incumplimiento de las obligaciones de buena fe"", expresa el documento. 
grg 
 
",,https://www.eluniversal.com.mx/mundo/ue-amenaza-con-acciones-legales-al-reino-unido-por-ley-sobre-el-brexit
,,http://www.eluniversal.com.mx/autor-opinion/articulistas/alfonso-zarate
"

“Dictadura: sistema de gobierno en el que lo que no está prohibido es obligatorio”.
 Enrique Jardiel Poncela.
López Obrador considera que toda crítica a su gestión es un ataque que nace de la conspiración contra su transformación. El presidente es intolerante al espejo, se autoproclama el más atacado por la prensa desde Francisco I. Madero, aunque, más bien, parece ser al revés, como si fuese el presidente que más ha atacado a la prensa y al libre pensamiento.
El presidente cuenta con un buen ejército de periodistas zalameros y aduladores en varios medios de comunicación, algunos incluso, habrá que reconocerlo, con gran solvencia intelectual y otros, francamente, irrisorios al grado de caricatura, además habría que sumar los millones de bots en redes sociales que son financiados con recursos oscuros para intimidar a los críticos de la 4T e intentar imponer una sola agenda en la conversación digital.
López Obrador impulsa una agenda peligrosa para cualquier democracia, apuesta, como sus colegas populistas en el mundo, por la imposición de un pensamiento único, por la homogeneización de la narrativa, porque la única “verdad verdadera” sea la que dicta su imaginación. Suena muy peligroso, pero al final, cuando nos demos cuenta del abismo en el que caímos, el presidente perderá.
Allá por mediados del siglo pasado esa fue la esencia del amasio entre la prensa y el gobierno, los columnistas se peleaban por la lisonja más dulce, por una lamida de suelas cada vez más creativa, más rebuscada y más arrastrada…
Sí, por aquellos días eso funcionaba frente a una sociedad tan inocente como ignorante y frente a un mundo tan desconectado entre sí que permitía a las naciones sumirse en los conflictos de su ombligo sin mirar al otro, ignorando al mundo por lo redondo.
Ni la actualidad ni el futuro pintan de ese modo, el mosaico de opiniones e ideologías es asfixiante, incalculable y sumamente complejo.
Asumir que la vida social y política en el globo, y en el país, es maniquea, que solo existe, a rajatabla, la derecha o la izquierda, el blanco o el negro, los buenos o los malos, termina traduciéndose en una frustración generalizada, en una rabia contenida que puede explotar en formas peligrosas para una nación y que, siempre, nos llevará a la estúpida manía de querer imponer un pasado que murió en un presente que no dejamos nacer.
El presidente es un ejemplo de la compleja diversidad ideológica que hoy vivimos: es un hombre conservador al extremo de la religiosidad, lo que podría hacerlo parecerse más a un político de derecha, incluso ultra neoliberal dadas sus políticas que ahogan el gasto público al grado de la paralización, pero al mismo tiempo es un hombre que aborrece el mercantilismo, que quiere sancionar libertades económicas en el alarmante roce de la expropiación, lo que, también, podría colocarlo en las ultraizquierdas… El presidente es, al final, un populista.
Y los populistas quieren imponer su única visión sin importar que ésta tenga tintes de derechas y de izquierdas al mismo tiempo, porque los populistas no creen en la democracia, ni en una ideología ajena a la suya en todos los sentidos, creen en un sistema autoritario, ellos creen y quieren una especie de nueva monarquía, son los nuevos emperadores.
Algunas sociedades terminan por aceptar muy bien al populista, máxime cuando éste les garantiza, en la realidad y no en el mundo de las ilusiones, bonanzas económicas, seguridad y una sensación plena de progreso social.
Ese no es nuestro caso, por eso creo que este experimento populista mexicano terminará en un fracaso monumental que pagaremos caro.
Aunque, ¿AMLO será el último populista mexicano?, vaya que siempre podremos estar peor.
Y sí, también, siempre podremos estar mejor. Al final, depende más de nosotros reflexionar en quién confiaremos nuestro voto.

De Colofón

La toma de la CNDH parte de una lucha legítima, sí, pero esperemos que el movimiento no termine degradándose en el fortalecimiento de los radicales okupas mexicanos y seamos testigos de las tomas de edificios públicos por justicia del pueblo.
@LuisCardenasMX
",,http://www.eluniversal.com.mx/opinion/luis-cardenas/el-populista
"
Los Chiefs inauguran esta noche la temporada 2020 de la NFL y abren sus puertas a sus aficionados.
Kansas City, campeón defensor del Super Bowl, acogerá a 16 mil 46 fanáticos en las gradas del Arrowhead Stadium, para la celebración de la inauguración de la campaña.
De las tres ligas de deportes profesionales más populares en Estados Unidos, sólo la NFL dejó a sus equipos generar sus propias medidas sanitarias, mientras que la NBA concentró a las franquicias en una burbuja en Orlando y MLB ha disputado todos sus juegos sin público en las gradas.
PUEDES VER: ¡Regresa la NFL! Todo lo que debes saber de la temporada
Mark Donovan, presidente de los Chiefs, comentó que los televidentes prestarán especial atención a los fanáticos, ya que el equipo es uno de los pocos equipos selectos que permite al menos algunos fanáticos en su primer partido en casa.
""Tenemos una oportunidad frente a nosotros para mostrarle al mundo que podemos hacer esto con éxito y que podemos tener eventos como este"", dijo el ejecutivo.
El mes pasado, los campeones de la NFL anunciaron un conjunto de protocolos de sanidad tanto dentro del Arrowhead Stadium como en los estacionamientos para mantener a todos a salvo del Covid-19. Donovan añadió que el plan del equipo es integral y está diseñado para mantener seguros a los jugadores, fanáticos, entrenadores, árbitros y trabajadores, pero también intenta hacerlo “en un entorno que aún tiene la energía que se merece”.

Los Chiefs ya tuvieron una práctica, durante un entrenamiento de pretemporada dentro del recinto, en el cual aficionados portaron cubrebocas de manera obligatoria, se les midió la temperatura al ingreso del inmueble y guardaron un distanciamiento social; sin embargo, las tiendas y servicios estuvieron abiertos y lo estarán hoy también, para comprar bebidas y alimentos.
Los Jaguars, que reciben a Indianapolis este domingo, es la otra franquicia que abrirá su estadio durante el fin de semana, con el acceso a 16 mil seguidores. Franquicias como Cowboys, Colts, Dolphins y Browns harán lo propios hasta la siguiente jornada, cuando sean locales.
",,https://www.eluniversal.com.mx/universal-deportes/futbol-americano/nfl-chiefs-recibiran-16-mil-aficionados-en-regreso-de-temporada
,,http://www.eluniversal.com.mx/autor-opinion/columnistas/periodistas-el-universal/bajo-reserva
"
Leer en español
Crime reporter Julio Valdivia was murdered and decapitated in Veracruz. The newspaper he worked for reported the news on Wednesday. 
The newspaper “El Mundo,” based in Córdoba, said the body of reporter Julio Valdivia was found near his motorcycle on railroad tracks in the town of Tezonapa, Veracruz. 
Valdivia, who covered a rural zone near the border with Oaxaca state that has long been plagued by gang violence, was at least the sixth journalist to be killed in Mexico this year.
The Committee to Protect Journalists condemned the “terrible events” and issued an “urgent call” for authorities to identify those responsible.
Recommended: Gunmen killed journalist Pablo Morrugares and his bodyguard in Guerrero
In August, an independent journalist died in police custody in a Mexican border city. Juan Nelcio Espinoza had been arrested while covering a confrontation in the city of Piedras Negras, across from Eagle Pass, Texas.
Espinoza was reporting for his web page “El Valedor TV,” and was taken by police to a hospital, where he was pronounced dead.
Authorities in Coahuila told local media that Espinoza and another man were arrested after engaging in a confrontation with police and that Espinoza choked to death.
More than 140 journalists have been killed in Mexico over the past 20 years.

President López Obrador demands an investigation
After news of the brutal murder broke, President Andrés Manuel López Obrador demanded an investigation and a sanction for those behind the crime. The Mexican President added his administration must find those who murdered the journalist. 
“I’ve been to Tezonapa and I know the importance of El Mundo de Córdova, how heroic it is to be a journalist in that region, as well as in other regions. This is why there has to be an investigation and punish those responsible,” López Obrador said.
Recommended: Mexican authorities sentence gang leader to 50 years in prison for his involvement in the murder of journalist Miroslava Breach

A dangerous country for journalists
In August 2019, EL UNIVERSAL reported that more journalists were being murdered in Mexico than in Afghanistan.
 
Throughout 2019, criminals murdered 25 journalists from different countries. Unfortunately, a third of the victims were killed in Mexico.
 
It is a disgrace that Mexico, a country that is not officially going through armed conflict, tripled the number of journalists killed in Afghanistan. In contrast, the Asian country registered the death of three journalists amid civil war and while it is under the yoke of Al-Qaeda, ISIS, and the Taliban. Pakistan and Somalia are in third place after registering 2 dead journalists.
 
Mexico became “the deadliest country to be a journalist” and also plunged into the 140th place, among 180, in the World Press Freedom Index.
 
gm
 
",,https://www.eluniversal.com.mx/english/crime-reporter-julio-valdivia-found-decapitated-veracruz
